{
  "$schema": "http://json-schema.org/draft-07/schema#",
  "$id": "https://github.com/spacedouut/phase/config.schema.json",
  "title": "phase configuration",
  "description": "Configuration schema for phase — a CLI tool for managing Proxmox VE virtual machines",

  "type": "object",
  "additionalProperties": false,
  "required": [],

  "properties": {
    "default_user": {
      "description": "SSH user used when a VM's cloud-init ciuser is not set. VMs created from phase templates inherit ciuser from the template",
      "type": "string",
      "default": "root",
      "examples": ["ubuntu", "root"]
    },

    "naming": {
      "description": "Naming conventions for VMs and resources. Names are auto-validated against these rules",
      "type": "object",
      "additionalProperties": false,
      "properties": {
        "pattern": {
          "description": "Regex pattern that all VM and service names must match (alphanumeric, lowercase, hyphens only)",
          "type": "string",
          "default": "^[a-z][a-z0-9-]*$",
          "examples": ["^[a-z][a-z0-9-]*$"]
        },
        "max_length": {
          "description": "Maximum length for VM names (env-service-instance)",
          "type": "integer",
          "minimum": 1,
          "maximum": 255,
          "default": 63
        },
        "env_separator": {
          "description": "Separator between env, service, and instance in VM names",
          "type": "string",
          "default": "-",
          "examples": ["-", "_", "."]
        }
      }
    },

    "networks": {
      "description": "Network alias definitions. Each alias maps to one or more CIDR ranges. Aliases are used in firewall rules (--from <alias>) and for auto-detecting the best IP for SSH connections",
      "type": "object",
      "additionalProperties": {
        "type": "array",
        "minItems": 1,
        "items": {
          "type": "string",
          "pattern": "^([0-9]{1,3}\\.){3}[0-9]{1,3}/([0-9]|[12][0-9]|3[0-2])$",
          "description": "CIDR notation (e.g. 192.168.1.0/24)"
        }
      },
      "examples": [
        {
          "lan": ["192.168.0.0/16"],
          "mgmt": ["10.0.0.0/8"]
        }
      ]
    },

    "templates": {
      "description": "Proxmox template VM conventions. Defines how templates are named and what resource sizes are available",
      "type": "object",
      "additionalProperties": false,
      "properties": {
        "prefix": {
          "description": "Prefix for template VM names",
          "type": "string",
          "default": "tpl"
        },
        "separator": {
          "description": "Separator between prefix, size, and OS in template names",
          "type": "string",
          "default": "-"
        },
        "sizes": {
          "description": "Available VM resource sizes. Validates --size against these definitions",
          "type": "object",
          "additionalProperties": {
            "type": "object",
            "additionalProperties": false,
            "required": ["cores", "memory"],
            "properties": {
              "cores": {
                "description": "Number of vCPUs",
                "type": "integer",
                "minimum": 1,
                "examples": [1, 2, 4, 8]
              },
              "memory": {
                "description": "Memory in MB",
                "type": "integer",
                "minimum": 128,
                "examples": [1024, 2048, 4096, 8192]
              }
            }
          },
          "examples": [
            {
              "micro": { "cores": 1, "memory": 1024 },
              "small": { "cores": 2, "memory": 2048 }
            }
          ]
        }
      }
    },

    "bootstrap": {
      "description": "Bootstrap script configuration. Scripts are uploaded to the VM via QEMU Guest Agent and executed with sudo. Per-OS overrides take precedence for the matching OS",
      "type": "object",
      "additionalProperties": false,
      "properties": {
        "directory": {
          "description": "Base directory containing bootstrap scripts. Used as root for relative paths in os_overrides",
          "type": "string",
          "default": "/opt/labctl/bootstrap",
          "examples": ["/opt/phase/bootstrap", "/opt/labctl/bootstrap"]
        },
        "os_overrides": {
          "description": "Per-OS bootstrap script paths. Keys match --os values. Paths are relative to bootstrap.directory",
          "type": "object",
          "additionalProperties": {
            "type": "object",
            "additionalProperties": {
              "type": "string",
              "description": "Path to the OS-specific script (relative to bootstrap.directory)"
            }
          },
          "examples": [
            {
              "ubuntu-24-04-lts": { "system": "ubuntu/initialize_system.sh" },
              "debian-12": { "system": "debian/initialize_system.sh" }
            }
          ]
        }
      }
    },

    "vm": {
      "description": "Default VM behaviour settings",
      "type": "object",
      "additionalProperties": false,
      "properties": {
        "agent": {
          "description": "Whether the QEMU Guest Agent should be enabled by default on new VMs",
          "type": "boolean",
          "default": true
        },
        "ssh_keys": {
          "description": "SSH public keys injected into every new VM's cloud-init, merged with (and deduped against) keys inherited from the template. Each entry is either a path to a .pub file or a literal public-key string.",
          "type": "array",
          "items": {
            "type": "string",
            "description": "Path to a .pub file (e.g. /root/.ssh/id_ed25519.pub) or a literal 'ssh-... ' key string"
          },
          "examples": [["/root/.ssh/id_ed25519.pub"]]
        }
      }
    },

    "ui": {
      "description": "UI and interactivity preferences",
      "type": "object",
      "additionalProperties": false,
      "properties": {
        "confirm_destructive": {
          "description": "Require explicit confirmation before destructive operations (destroy, reset)",
          "type": "boolean",
          "default": true
        }
      }
    }
  }
}
